{
  "mission_id": "01TESTMISSION000000000001",
  "run_id": "01TESTRUN0000000000000001",
  "step_id": "review",
  "action": "review WP03",
  "profile_slug": "reviewer-v1",
  "profile_version": "1.2.0",
  "actor": {
    "actor_id": "claude-opus",
    "actor_type": "llm",
    "display_name": "Claude Opus",
    "provider": "anthropic",
    "model": "claude-opus-4-6"
  },
  "governance_scope": "mission-level"
}
